{
  "mission_id": "01JTJ8M3Z3ZV4A6J3B1Q4JQ8RM",
  "run_id": "run-analytics-001",
  "step_id": "implement",
  "wp_id": "WP03",
  "phase_name": "implementation",
  "actor": {
    "actor_id": "codex",
    "actor_type": "llm",
    "display_name": "Codex",
    "provider": "openai",
    "model": "gpt-5.4",
    "tool": "codex"
  },
  "provider": "openai",
  "model": "gpt-5.4",
  "input_tokens": 1200,
  "output_tokens": 300,
  "total_tokens": 1500,
  "estimated_cost_usd": 0.036,
  "source": "runtime-usage"
}
